Similar,Opposite,Sideways
"During my early, impressionable years",In my later and more resilient years,"Just before heading off to college,"
In the days of my youth and naivety,During the mature stages of my life,"On a cool evening by the fire,"
When I was young and easily influenced,In the autumn of my wisdom,"During one of our long walks in the woods,"
In my formative and susceptible years,When I was older and more fortified,"As we sat watching the sunset,"
Back when I was young and defenseless,During my experienced and toughened years,"Right after a tough day at school,"
During my inexperienced and sensitive years,In the days of my seasoned maturity,"While we were fixing up the old barn,"
In my youthful and fragile period,When I had grown strong and secure,"One morning over breakfast,"
While I was tender and vulnerable,"In my later years, wiser and more guarded","During our annual family vacation,"
At a time when I was naive and young,As I aged and gained resilience,"Under the old oak tree where we used to chat,"
During the years of my early innocence,When my vulnerabilities had hardened into strengths,"As we drove through the countryside,"
In my juvenile and impressionable days,In the years of my hardened wisdom,"In the quiet moments before bedtime,"
When I was fresh and unprotected,"During the later, secure stages of my life","While teaching me how to change a tire,"
In the early days of my vulnerability,When I was no longer naive nor young,"On the eve of my wedding,"
While I was young and exposed,In the twilight of my hardened experiences,"During our Sunday evening talks,"
During my nascent and susceptible era,"During my mature, unyielding years","As he helped me pack for my big move,"
In the springtime of my fragility,"In the winter of my life, seasoned and wise","In the midst of a family crisis,"
When my youth was tender and raw,When I had reached a more fortified stage,"Right before I made a major life decision,"
In the dawn of my impressionable years,In the seasoned days of my elder wisdom,"During one of our fishing trips,"
During my early days of innocence,"During my later years, resilient and experienced","As we built a model airplane together,"
When I was youthful and unguarded,When I was aged and less impressionable,"While cooking our favorite meal,"
In my less experienced years,In the days when youth's naivety had faded,"On my way out the door on my first day of work,"
During the vulnerable days of my youth,"During the later, more secure stages of my life","As I struggled with a difficult choice,"
In my tender and susceptible years,When I was wise beyond my former vulnerabilities,"In his own unique way,"
When I was delicate and young,In my seasoned years of strength,"During a rare moment of quiet,"
In the beginning of my vulnerable years,"During the twilight years, wise and protected","As we walked through the old neighborhood,"
During my formative and sensitive days,When experience had replaced my youthful vulnerabilities,"During a heartfelt conversation over coffee,"
In the days of my tender youth,In my matured and fortified days,"As we cleaned out the garage one weekend,"
When I was inexperienced and impressionable,During the later years of resilience and wisdom,"Right before I left home for the first time,"
In my naive and defenseless years,When I had grown older and tougher,"As he showed me how to shave,"
During my earliest days of vulnerability,"In the advanced years of my life, secure and seasoned","During a break in the Thanksgiving festivities,"
In my unseasoned and delicate years,"During the wiser, less vulnerable stages of my life","On a long drive home after a challenging day,"
When I was young and unshielded,When my early innocence had turned to savvy resilience,"While we sat on the porch during a summer evening,"
In the early and impressionable stage of life,"In my elder years, fortified against naivety","During our last holiday together,"
During the naive days of my youth,"During the days of my wise, experienced self","As he repaired an old family heirloom,"
In my sensitive and formative years,"When I was older, wiser, and impervious","While we were hiking our favorite trail,"
When I was new and vulnerable,"In the later, secure period of my life","During a pause in a heated argument,"
In my earliest and most delicate years,During my years of cultivated wisdom and strength,"As we looked through old family photos,"
During my susceptible and youthful days,When the vulnerabilities of youth had passed,"While planting the spring garden,"
In the youthful days of innocence and vulnerability,In my aged and experienced years,"On a lazy Sunday afternoon,"
When I was green and unprotected,During the resilient phase of my elder years,"As we packed up the car for a road trip,"
In the infancy of my vulnerability,When the fragilities of youth had hardened,"During a quiet moment after a storm,"
During my early years of naivety,In the latter days of mature wisdom,"As he taught me how to tie a necktie,"
In my young and tender years,During my sage and seasoned years,"During a spontaneous road trip,"
When I was innocent and unprotected,When I was no longer susceptible nor tender,"As we prepared for a family gathering,"
In the first days of my youthful vulnerability,In the days of my solidified strength,"On the morning of a significant life event,"
During my impressionable and tender years,"During the matured, wiser years of my life","As we decorated the house for the holidays,"
"In my youth, na√Øve and exposed",When my younger weaknesses had become strengths,"During one of our yearly traditions,"
When my experiences were young and soft,In the seasoned twilight of my existence,"As he showed me how to balance a checkbook,"
In the initial years of my vulnerability,"During the later, fortified years of my life","In a rare serious tone one evening,"
"During the early, delicate stages of my life",When age and wisdom had replaced vulnerability,As we prepared my old room for new beginnings
"Back when I was just a kid,","Now that I’m older and tougher,","I would never have expected it, but,"
"In the days I was younger and didn't know much,","In my current, more confident years,","Once upon a time,"
"When I was little and still figuring things out,","Now that I'm wiser and not so easily fooled,","Pardon my interruption, but when,"
"During my early years when everything was a big deal,","As I got older and stronger,","If you could see what I see,"
"Back in my younger days, when I was super gullible,","Now that I'm bigger and know better,","Believe it or not,"
"When I was small and everything seemed huge,","In these years where I stand my ground,","Against all odds,"
"In the times I was young and pretty clueless,","Now that I’m more experienced and less scared,","Little did they know,"
"During my early years, when I trusted everyone,","As I've grown up and toughened up,","In the blink of an eye,"
"Back when I was a kid and everything scared me,","In my recent years, feeling more secure,","From the moment I woke up,"
"In my younger days when I was still learning the ropes,","Now, being older and not so naive,","What happened next might surprise you,"
"When I was little and the world seemed so big,","As I’ve matured and gotten smarter,","Before you judge me,"
"Back in the days when I was young and super naive,","In these days, where I’m not so vulnerable,","Contrary to popular belief,"
"In the years I was just a youngster and pretty vulnerable,","Now that I’m older and much more cautious,","If only I had known,"
"When I was younger and everything was new to me,","As I've grown and become less impressionable,","Without a moment's hesitation,"
"During the times I was a young kid and not that tough yet,","Now, in my less gullible and more seasoned years,","As fate would have it,"
"Back when I was little and not too sharp,","Now that I'm older and not so easy to trick,","On a day unlike any other,"
"In those days when I was young and pretty gullible,","In my current years, feeling a lot braver,","With a heavy heart,"
"When I was smaller and didn’t know much,","As I get older and a bit smarter about things,","It all began with a seemingly innocent,"
"Back then, when I was naive and easily tricked,","Now, being tougher and more careful,","Who would have thought that,"
"In my earlier years, when I trusted just about everyone,","These days, when I’m not so naive anymore,","In a world where,"
"When I was younger and let people fool me easily,","In my later years, where I stand up for myself more,","Despite everything,"
"During the times I was little and believed everything I heard,","Now that I know more and fall for less,","Under the cover of darkness,"
"In my youth, when I was open to everything and doubted nothing,","As I grow up and see things clearer,","Far beyond the ordinary,"
"When I was a kid and thought the world was super simple,","In my current phase, being less trusting and more questioning,","Caught in the act,"
"Back when I was younger and hadn’t learned to question things,","Now that I’m not so little and way more confident,","With the last of my strength,"
"In those days, when I took every word at face value,","As I’m getting older and figuring things out better,","Out of nowhere,"
"When I was a young kid and didn’t see the twists in tales,","In these years, being way less gullible,","Between the lines of the ordinary,"
"Back in my less skeptical days,","Now, when I’m older and not as easily scared,","Beyond the realm of possibility,"
"In my childhood years, when everything seemed straightforward,","As I mature and don’t let people fool me,","Under unusual circumstances,"
"When I was small and saw the world in black and white,","Now, in my more cautious and knowledgeable years,","As the clock struck midnight,"
,,"To everyone's astonishment,"
,,"With great reluctance,"
,,"Through the looking glass,"
,,"In an unexpected twist of fate,"
,,"At the edge of the world,"
,,"Where no one would venture,"
,,"Faced with an impossible choice,"
,,"As the story goes,"
,,"With a twist of fate,"
,,"In the shadow of doubt,"
,,"Just when all seemed lost,"
,,"As the sun set on an era,"
,,"When push came to shove,"
,,"Caught between a rock and a hard place,"
,,"In the heat of the moment,"
,,"On the verge of discovery,"
,,"As whispers filled the air,"
,,"In the dead of night,"
,,"Beyond the edge of reason,"
,,"At the crossroads of destiny,"